{
  "id": "pair_tactical_judgment_002",
  "kind": "rewrite_pair",
  "title": "战术判断别靠比喻和黑话硬撑",
  "tags": [
    "rewrite_pair",
    "tactical_judgment",
    "dialogue_rewrite",
    "plain_language"
  ],
  "applicable_genres": [
    "历史/权谋",
    "末世",
    "战争",
    "边关争霸男频"
  ],
  "trigger_phrases": [
    "把咱们眼睛全拽过去",
    "主口",
    "主杀招",
    "有鬼"
  ],
  "bad_example": "正面打得这么响，就是想把咱们眼睛全拽过去。主口也走，但不是主杀招。东坡一直黑着，那边才有鬼。",
  "good_example": "正面喊得越凶，越是想把我们的兵力和注意压在正门。正门会打，但那边只是幌子，他们真正想走的是东坡。东坡一直不点火，就是怕我们提前看见，他们想趁黑摸上来。",
  "problem": "原句表面像在分析战局，实际只是在堆作者脑内简称和比喻。读者知道对面有后手，却不知道后手是什么、从哪来、根据是什么。",
  "rewrite_strategy": [
    "先把诱敌动作说清，再说真正的进攻方向",
    "把黑话换成正门、东坡、摸上来这类能立刻形成画面的词",
    "把判断依据落到火把、兵力、地形、动静等可见征兆上"
  ]
}
